,title,date,abstract,word_count,abstract_clean
61,"Combining qualitative and quantitative understanding for exploring cross-sectoral climate change impacts, adaptation and vulnerability in Europe",2013-01-01,"Climate change will affect all sectors of society and the environment at all scales, ranging from the continental to the national and local. Decision-makers and other interested citizens need to be able to access reliable science-based information to help them respond to the risks of climate change impacts and assess opportunities for adaptation. Participatory integrated assessment (IA) tools combine knowledge from diverse scientific disciplines, take account of the value and importance of stakeholder 'lay insight' and facilitate a two-way iterative process of exploration of 'what if's' to enable decision-makers to test ideas and improve their understanding of the complex issues surrounding adaptation to climate change. This paper describes the conceptual design of a participatory IA tool, the CLIMSAVE IA Platform, based on a professionally facilitated stakeholder engagement process. The CLIMSAVE (climate change integrated methodology for cross-sectoral adaptation and vulnerability in Europe) Platform is a user-friendly, interactive web-based tool that allows stakeholders to assess climate change impacts and vulnerabilities for a range of sectors, including agriculture, forests, biodiversity, coasts, water resources and urban development. The linking of models for the different sectors enables stakeholders to see how their interactions could affect European landscape change. The relationship between choice, uncertainty and constraints is a key cross-cutting theme in the conduct of past participatory IA. Integrating scenario development processes with an interactive modelling platform is shown to allow the exploration of future uncertainty as a structural feature of such complex problems, encouraging stakeholders to explore adaptation choices within real-world constraints of future resource availability and environmental and institutional capacities, rather than seeking the 'right' answers.",262,affect sector society environment scale ranging continental national local decision maker interested citizen need able access reliable science based information help respond risk impact ass opportunity participatory integrated assessment ia tool combine knowledge diverse scientific discipline take account value importance stakeholder lay insight facilitate way iterative process exploration enable decision maker test idea improve understanding complex issue surrounding describes conceptual design participatory ia tool climsave ia platform based professionally facilitated stakeholder process climsave integrated methodology cross sectoral vulnerability europe platform user friendly interactive web based tool allows stakeholder ass impact vulnerability range sector including agriculture forest biodiversity coast water resource urban development linking model different sector enables stakeholder see interaction could affect european landscape relationship choice uncertainty constraint key cross cutting theme conduct past participatory ia integrating scenario development process interactive modelling platform allow exploration future uncertainty structural feature complex problem encouraging stakeholder explore choice within real world constraint future resource availability environmental institutional capacity rather seeking answer
62,Participatory scenario development for environmental management: A methodological framework illustrated with experience from the UK uplands,2013-01-01,"A methodological framework is proposed for participatory scenario development on the basis of evidence from the literature, and is tested and refined through the development of scenarios for the future of UK uplands. The paper uses a review of previous work to justify a framework based around the following steps: i) define context and establish whether there is a basis for stakeholder engagement in scenario development; ii) systematically identify and represent relevant stakeholders in the process; iii) define clear objectives for scenario development with stakeholders including spatial and temporal boundaries; iv) select relevant participatory methods for scenario development, during initial scenario construction, evaluation and to support decision-making based on scenarios; and v) integrate local and scientific knowledge throughout the process. The application of this framework in case study research suggests that participatory scenario development has the potential to: i) make scenarios more relevant to stakeholder needs and priorities; ii) extend the range of scenarios developed; iii) develop more detailed and precise scenarios through the integration of local and scientific knowledge; and iv) move beyond scenario development to facilitate adaptation to future change. It is argued that participatory scenario development can empower stakeholders and lead to more consistent and robust scenarios that can help people prepare more effectively for future change. (C) 2013 The Authors. Published by Elsevier Ltd. All rights reserved.",221,methodological framework proposed participatory scenario development basis evidence literature tested refined development scenario future uk upland us review previous work justify framework based around following step define context establish whether basis stakeholder scenario development ii systematically identify represent relevant stakeholder process iii define clear objective scenario development stakeholder including spatial temporal boundary select relevant participatory method scenario development initial scenario construction evaluation support decision making based scenario v integrate local scientific knowledge throughout process application framework research suggests participatory scenario development potential make scenario relevant stakeholder need priority ii extend range scenario developed iii develop detailed precise scenario integration local scientific knowledge move beyond scenario development facilitate future argued participatory scenario development empower stakeholder lead consistent robust scenario help people prepare effectively future c author published right
63,Strategic Bundling of Development Policies with Adaptation: An Examination of Delhi's Climate Change Action Plan,2013-01-01,"A growing number of cities in the global South are taking proactive action on climate change. Their plans provide insights into the potential for strategically bundling long-term development policymaking with the climate agenda. In this article I study the case of Delhi, the first city in India to adopt a climate change action plan. Drawing on the literature on urban ecological security, I examine: (1) the adaptation challenges that Delhi faces; (2) the multiple motivations that underlie early action; (3) the key actors, strategies, and associated action domains outlined in the plan; and (4) the extent to which the plan seeks to bring about systemic change. Proactive action at the city level serves multiple strategic goals. Delhi's case is significant in illustrating how it has leveraged emergent opportunities to advance its short-term development agenda, given the tight fiscal constraints and governance challenges it faces. The plan has been strategically formulated to enhance competiveness, facilitate image-building, garner support for pet projects and access alternative sources of funding. But the short-term orientation of the plan and its limited mechanisms for citizen engagement have severely restrained its capacity to address underlying social vulnerabilities or bring about transformative change.",195,growing number city global south taking proactive action plan provide insight potential strategically bundling long term development policymaking agenda delhi first city india adopt action plan drawing literature urban ecological security examine challenge delhi face multiple motivation underlie early action key actor strategy associated action domain outlined plan extent plan seek bring systemic proactive action city level serf multiple strategic goal delhi significant illustrating leveraged emergent opportunity advance short term development agenda given tight fiscal constraint governance challenge face plan strategically formulated enhance competiveness facilitate image building garner support pet project access alternative source funding short term orientation plan mechanism severely restrained capacity address underlying social vulnerability bring transformative
64,Mainstreaming climate change adaptation: An incremental approach to disaster risk management in Australia,2013-01-01,"In this paper we argue that rationalist 'predict then act' approaches to disaster risk management (DRM) policy promote unrealistic public expectations of DRM provisions, the avoidance of decision making by political elites, an over-reliance on technical expertise and engineering solutions to reducing exposure to natural events, and a reactive approach to DRM overall. We propose an alternative incrementalist approach that focuses on managing uncertainties rather than reducing them and building resilience not simply through the reduction of hazard exposure, but also through the ongoing reduction of community vulnerability, the explicit consideration of normative priorities, and more effective community engagement in climate risk debates. (C) 2013 Elsevier Ltd. All rights reserved.",110,argue rationalist predict act approach disaster risk management drm policy promote unrealistic expectation drm provision avoidance decision making political elite reliance technical expertise engineering solution reducing exposure natural event reactive approach drm overall propose alternative incrementalist approach focus managing uncertainty rather reducing building resilience simply reduction hazard exposure ongoing reduction community vulnerability explicit consideration normative priority effective community risk debate c right
65,Planning for Climate Change: Is Greater Public Participation the Key to Success?,2013-01-01,"Within most democracies there is an assumption that greater public participation and engagement in policy processes results in more effective policy measures. These assumed benefits include better framed and more robust policies and a more informed, articulate and engaged citizenry. Similar assumptions exist also in planning for climate adaptation where more public participation and engagement are seen as vital components of any adaptation strategy and policy development process. This article explores these assumptions and considers whether there is any evidence that the success of planning for unavoidable climate change is related to the extent of public participation. Using an evaluation framework based on three aspects of participation we critically review a set of climate adaptation policy instruments developed within each of the three levels of government in Australia but with a specific focus on the region of South East Queensland.",140,within democracy assumption greater participation policy process result effective policy measure assumed benefit include better framed robust policy informed articulate engaged citizenry similar assumption exist planning participation seen vital component strategy policy development process explores assumption considers whether evidence success planning unavoidable related extent participation evaluation framework based three aspect participation critically review set policy instrument developed within three level government australia specific focus region south east queensland
66,Adaptation to changing water resource availability in Northern India with respect to Himalayan Glacier retreat and changing monsoons using participatory approaches,2013-01-01,"Changes in rainfall patterns and temperatures are likely to affect water resources in India. Also, changes in the extreme events will have direct implications on life and property. Adapting to the adverse effects of climate change becomes critical to avoid huge material and immaterial damages. This paper discusses the use of a multi-level and participatory approach to develop adaptation options to deal with climate related risks in a manner that contributes to stakeholder engagement, understanding of the risks, identification of the adaptation responses as well as its prioritization for risk reduction. It highlights the importance of involving stakeholders from multiple levels as each level corresponds with different priorities in adaptation options. (C) 2013 Elsevier B.V. All rights reserved.",118,change rainfall pattern temperature likely affect water resource india change extreme event direct implication life property adapting adverse effect becomes critical avoid huge material immaterial damage discus use multi level participatory approach develop option deal related risk manner contributes stakeholder understanding risk identification response well prioritization risk reduction highlight importance involving stakeholder multiple level level corresponds different priority option c b v right
67,Resilience. Preparing New Jersey for climate change: Policy considerations from the New Jersey Climate Adaptation Alliance,2014-01-01,"This report builds upon the December 2013 report by identifying recommendations that correspond to the six major categories in the gap analysis (agriculture, built infrastructure, coastal communities, natural resources, public health, water resources). These recommendations incorporate iterative consideration by the Alliance Advisory Committee in consultation with stakeholder engagement partners and technical experts.",52,report build upon december report identifying recommendation correspond six major category gap analysis agriculture built infrastructure coastal community natural resource health water resource recommendation incorporate iterative consideration alliance advisory committee consultation stakeholder partner technical expert
68,"Psychological care of caregivers, nurses and physicians: a study of a new approach",2014-01-01,"There is much evidence demonstrating that psychosocial interventions in caregivers and oncological staff produce an improvement in their patients' quality of life. The aim of this explorative study was to evaluate the effect of a new approach in promoting more functional ways to face stressful situations in the constellation of people around patients: caregivers, physicians and nurses. Thirty-four subjects were divided into three groups: 10 care-givers, 11 physicians, and 13 nurses. A ""Balint Group"" method modified according to a mind-fulness technique was used as the intervention. Three assessment tools were administered to the participants at baseline, during, and after completion of the study: the Response Evaluation Measure (REM-71), the Satisfaction Profile (SAT-P), and the Group Climate Questionnaire (GCQ). Mean values of defense mechanisms determined by the REM-71 were compared with those of the standard population. At baseline, we observed a prevalence of immature defenses in the three groups, with mean values above those in the standard population. After the psychological intervention, a tendency to normalization of the mean values was observed, indicating the development of more adaptive ways of using defense mechanisms and the effectiveness of the intervention. Group climate, assessed through the GCQ, showed an increase in the ""Engagement"" factor and a decline in the ""Conflict"" factor in all groups. This study suggests that group treatment focused on changing personal responses to stressful situations can induce more adaptive strategies enabling caregivers, hematologists, and nurses to help patients better and thereby improve their quality of life.",246,much evidence demonstrating psychosocial intervention caregiver oncological staff produce improvement patient quality life aim explorative evaluate effect approach promoting functional way face stressful situation constellation people around patient caregiver physician nurse thirty four subject divided three group care giver physician nurse balint group method modified according mind fulness technique used intervention three assessment tool administered participant baseline completion response evaluation measure rem satisfaction profile sat p group questionnaire gcq mean value defense mechanism determined rem compared standard population baseline observed prevalence immature defense three group mean value standard population psychological intervention tendency normalization mean value observed indicating development adaptive way defense mechanism effectiveness intervention group assessed gcq showed increase factor decline conflict factor group suggests group treatment focused changing personal response stressful situation induce adaptive strategy enabling caregiver hematologist nurse help patient better thereby improve quality life
69,Adapting to climate change through urban water management: a participatory case study in Indonesia,2014-01-01,"The benefits of integrated approaches to climate risk and adaptation studies are increasingly recognised. Thus, there is an increasing need for practical examples of such work in the literature. This paper describes a practical application of an integrated framework for climate change impacts on regional surface water resources and the urban water system in the Mamminasata metropolitan region, Indonesia. Two main features of the framework are: the integration of both climate and other physical and social considerations in the assessment; and the high stakeholder involvement before, during and after project implementation. Although the study is concerned with the Mamminasata region, the overall methodology is transferable to any region in Indonesia or internationally. Key outcomes from this study are: (1) creation of information for Mamminasata planners and water resources managers for when, and under what conditions, the water supply may or may not meet the demand; (2) a clear consensus and shared learning of the problems facing the region among cross-institutional stakeholders; and (3) identification of adaptation options for the urban water system and knowledge gaps and strategies for their implementation. Results of stakeholders' surveys conducted at the mid-point and at the end of the study indicate that these outputs will provide valuable guidance for future planning and management of Mamminasata regional water resources.",213,benefit integrated approach risk study increasingly recognised thus increasing need practical example work literature describes practical application integrated framework impact regional surface water resource urban water system mamminasata metropolitan region indonesia main feature framework integration physical social consideration assessment high stakeholder involvement project implementation although concerned mamminasata region overall methodology transferable region indonesia internationally key outcome creation information mamminasata planner water resource manager condition water supply may may meet demand clear consensus shared learning problem facing region among cross institutional stakeholder identification option urban water system knowledge gap strategy implementation result stakeholder survey conducted mid point end indicate output provide valuable guidance future planning management mamminasata regional water resource
70,Climate change research and policy in Portugal,2014-01-01,"This article offers a review of research and policy on climate change in Portugal and is organized into three main themes: scientific knowledge and assessment of climate change; policy analysis and evaluation; and public engagement. Modern scientific research on meteorology and climatology started in Portugal in the 1950s and a strong community of researchers in climate science, vulnerabilities, impacts, and adaptation has since developed, particularly in the last decade. Nevertheless, there are still many gaps in research, especially regarding the economic costs of climate change in Portugal and costs and benefits of adaptation. Governmental policies with a strong emphasis on mitigation were introduced at the end of the 1990s. As greenhouse gas emissions continued to rise beyond its Kyoto target for 2012, the country had to resort to the Kyoto Flexibility Mechanisms in order to comply. Climate change adaptation policies were introduced in 2010 but are far from being fully implemented. Regarding public engagement with climate change, high levels of concern contrast with limited understanding and rather weak behavioral dispositions to address climate change. Citizens display a heavy reliance on the media as sources of information, which are dominated by a techno-managerial discourse mainly focused on the global level. The final part of the article identifies research gaps and outlines a research agenda. Connections between policy and research are also discussed. WIREs Clim Change 2014, 5:199-217. doi: 10.1002/wcc.258 Conflict of interest: The authors have declared no conflicts of interest for this article. For further resources related to this article, please visit the .",253,offer review research policy portugal organized three main theme scientific knowledge assessment policy analysis evaluation modern scientific research meteorology climatology started portugal strong community researcher science vulnerability impact since developed particularly last decade nevertheless still many gap research especially regarding economic cost portugal cost benefit governmental policy strong emphasis mitigation introduced end greenhouse gas emission continued rise beyond kyoto target country resort kyoto flexibility mechanism order comply policy introduced far fully implemented regarding high level concern contrast understanding rather weak behavioral disposition address citizen display heavy reliance medium source information dominated techno managerial discourse mainly focused global level final part identifies research gap outline research agenda connection policy research discussed wire clim doi wcc conflict interest author declared conflict interest resource related
71,Is the private forest sector adapting to climate change? A study of forest managers in north Wales,2014-01-01,"Two-thirds of Britain's forest area is privately owned. Thus, understanding private forest owners and managers, and their attitudes to uncertainty and change, is essential for the success of climate change adaptation policies. The aims of this study are to (1) assess how beliefs in climate change in the private sector have influenced forest management practices; (2) identify constraints related to changes in species choice and silvicultural systems; (3) analyse the implications for implementing climate change policy in forestry. Semi-structured interviews with key informants who provide advice to, or manage woodlands in, the private forest sector in north Wales. Woodland managers and some advisers are not generally convinced of a need to adapt. They feel the future is uncertain, more usually in relation to tree disease than to climate change itself. Species choice is the principle focus of adaptation activities and reveals a deep divide in opinion. Commercial advisors look to new exotics but are inhibited by absence of markets, while small-scale owners rely more on native genetic diversity. Findings that are likely to apply widely include: the influential role of forest agents in forest management decisions including species choice; lack of confidence in climate change predictions, and in markets; more immediate concerns about tree pests and diseases; demand for leadership from the public sector, and for engagement amongst the private sector. Further research is needed across a wider area to test the variability in relationship between attitudes and behaviours, and local conditions including climate change predictions.",246,third britain forest area privately owned thus understanding private forest owner manager attitude uncertainty essential success policy aim ass belief private sector influenced forest management practice identify constraint related change specie choice silvicultural system analyse implication implementing policy forestry semi structured interview key informant provide advice manage woodland private forest sector north wale woodland manager adviser generally convinced need adapt feel future uncertain usually relation tree disease specie choice principle focus activity reveals deep divide opinion commercial advisor look exotics inhibited absence market small scale owner rely native genetic diversity finding likely apply widely include influential role forest agent forest management decision including specie choice lack confidence prediction market immediate concern tree pest disease demand leadership sector amongst private sector research needed across wider area test variability relationship attitude behaviour local condition including prediction
