,title,date,abstract,word_count,abstract_clean
128,"""I don't get this climate stuff!' Making sense of climate change among the corporate middle class in Lagos",2015-01-01,"Public engagement continues to be central to wider efforts to address climate change. This study contributes to public engagement debates by investigating engagement with climate change among an often overlooked group, the corporate middle class in Africa's second largest megacity, Lagos. Combining survey and interviews, I focus analysis on three aspects: awareness, knowledge and concern; role of scientific and social frames in shaping general attitude; and spatial attribution of causes and consequences. The study reveals a universal awareness and high concern about climate change among the respondents, although understanding and perceptions of climate change are significantly socially framed. Social situatedness, more than scientific facts, is the most important definer of overall engagement with climate change. This study thus underscores a nuanced constructionist stance, showing how corporate professionals' ways of knowing' climate change is underpinned by a certain co-production between scientific and socio-experiential frames. I highlight implications for research and public engagement with climate change.",154,continues central wider effort address contributes debate investigating among often overlooked group corporate middle class africa second largest megacity lagos combining survey interview focus analysis three aspect awareness knowledge concern role scientific social frame shaping general attitude spatial attribution cause consequence reveals universal awareness high concern among respondent although understanding perception significantly socially framed social situatedness scientific fact important definer overall thus underscore nuanced constructionist stance showing corporate professional way knowing underpinned certain co production scientific socio experiential frame highlight implication research
129,Predictors of public climate change awareness and risk perception around the world,2015-01-01,"Climate change is a threat to human societies and natural ecosystems, yet public opinion research finds that public awareness and concern vary greatly. Here, using an unprecedented survey of 119 countries, we determine the relative influence of socio-demographic characteristics, geography, perceived well-being, and beliefs on public climate change awareness and risk perceptions at national scales. Worldwide, educational attainment is the single strongest predictor of climate change awareness. Understanding the anthropogenic cause of climate change is the strongest predictor of climate change risk perceptions, particularly in Latin America and Europe, whereas perception of local temperature change is the strongest predictor in many African and Asian countries. However, other key factors associated with public awareness and risk perceptions highlight the need to develop tailored climate communication strategies for individual nations. The results suggest that improving basic education, climate literacy, and public understanding of the local dimensions of climate change are vital to public engagement and support for climate action.",157,threat human society natural ecosystem yet opinion research find awareness concern vary greatly unprecedented survey country determine relative influence socio demographic characteristic geography perceived well belief awareness risk perception national scale worldwide educational attainment single strongest predictor awareness understanding anthropogenic cause strongest predictor risk perception particularly latin america europe whereas perception local temperature strongest predictor many african asian country however key factor associated awareness risk perception highlight need develop tailored communication strategy individual nation result suggest improving basic education literacy understanding local dimension vital support action
130,Wildlife restoration: Mainstreaming translocations to keep common species common,2015-01-01,"In most urban and agricultural landscapes, remnants of native vegetation are surrounded by an inhospitable matrix. Although vagile species come and go, many reptiles, amphibians and small mammals are effectively stranded and declining towards local extinction. In the same landscapes, other areas where these species are absent are improving in habitat quality, both through natural regeneration and active restoration efforts. So, for many species in many domesticated landscapes, there are too many individuals in some patches of decreasing quality and no individuals in patches of increasing quality. One solution to this situation is to move animals from those areas where there are plenty to suitable areas where there are none. These targeted translocations apply lessons learned from revegetation to dispersal-limited animals to in-fill distributional ranges, increase population size and improve both demographic and genetic connectivity, pushing nonequilibrial metapopulations away from extinction via an imposed mass effect. In contrast to conventional reintroduction schemes expensive, reactive interventions involving highly-trained specialists and captive-raised endangered species these inexpensive, proactive, community-driven initiatives aim to avert future declines by keeping common species common. Having introduced the wildlife restoration vision, we use two scenarios to illustrate the benefits of the approach to species, ecosystem function, ecological understanding, restoration practise and public engagement. As well as adhering to best-practise reintroduction techniques to ensure animal welfare is not compromised and avoid detrimental effects to source populations or release sites, we emphasize community participation, data quality and long-term accessibility as paramount to maximize learning opportunities. (C) 2015 Elsevier Ltd. All rights reserved.",252,urban agricultural landscape remnant native vegetation surrounded inhospitable matrix although vagile specie come go many reptile amphibian small mammal effectively stranded declining towards local extinction landscape area specie absent improving habitat quality natural regeneration active restoration effort many specie many domesticated landscape many individual patch decreasing quality individual patch increasing quality solution situation move animal area plenty suitable area none targeted translocation apply lesson learned revegetation dispersal animal fill distributional range increase population size improve demographic genetic connectivity pushing nonequilibrial metapopulations away extinction via imposed mass effect contrast conventional reintroduction scheme expensive reactive intervention involving highly trained specialist captive raised endangered specie inexpensive proactive community driven initiative aim avert future decline keeping common specie common introduced wildlife restoration vision use scenario illustrate benefit approach specie ecosystem function ecological understanding restoration practise well adhering best practise reintroduction technique ensure animal welfare compromised avoid detrimental effect source population release site emphasize community participation data quality long term accessibility paramount maximize learning opportunity c right
131,Climate change in the oceans: Human impacts and responses,2015-01-01,"Although it has far-reaching consequences for humanity, attention to climate change impacts on the ocean lags behind concern for impacts on the atmosphere and land. Understanding these impacts, as well as society's diverse perspectives and multiscale responses to the changing oceans, requires a correspondingly diverse body of scholarship in the physical, biological, and social sciences and humanities. This can ensure that a plurality of values and viewpoints is reflected in the research that informs climate policy and may enable the concerns of maritime societies and economic sectors to be heard in key adaptation and mitigation discussions.",96,although far reaching consequence humanity attention impact ocean lag behind concern impact atmosphere land understanding impact well society diverse perspective multiscale response changing ocean requires correspondingly diverse body scholarship physical biological social science humanity ensure plurality value viewpoint reflected research informs policy may enable concern maritime society economic sector heard key mitigation discussion
132,"Flood Risk Management as a public or a private good, and the implications for stakeholder engagement",2016-01-01,"A move to encourage partnership funding of Flood Risk Management (FRM) has resulted in current FRM measures providing both public and private benefits. Yet, the scales of service delivery associated with public and private goods are likely to influence the form and extent of public participation in FRM. We assess the range,of goods provided by FRM, whether these services are considered to be public in nature by authorities and citizens, and the impact this has upon the level and form of public engagement in FRM. We separate the definitions of public goods into 'pure' public goods which demonstrate characteristics of non-rivalry and non-excludability, and public priority goods which are services deemed as essential to public wellbeing regardless of characteristics. We find that English FRM delivers a range of public goods beyond that of reduced water flows, and that when FRM is considered a 'pure' public good the emergent form of public participation does not increase public awareness of flood risk or encourage investment in private protection measures. When the benefits of FRM are solely considered public priority goods public awareness of flood risk increases, yet disputes arise regarding service provision and maintenance. Importantly, increased flood risk from climate change or increased runoff could lead to the capacity of the public good provision being exceeded, leading to problems of distribution of that service, and reactionary pressure group formation. We argue that the current preference for public goods which reduce individual costs at the expense of public awareness can discourage adaptation, which may be problematic in ensuring sustainable FRM. (C) 2015 Elsevier Ltd. All rights reserved.",264,move encourage partnership funding flood risk management frm resulted current frm measure providing private benefit yet scale service delivery associated private good likely influence form extent participation frm ass range good provided frm whether service considered nature authority citizen impact upon level form frm separate definition good pure good demonstrate characteristic non rivalry non excludability priority good service deemed essential wellbeing regardless characteristic find english frm delivers range good beyond reduced water flow frm considered pure good emergent form participation increase awareness flood risk encourage investment private protection measure benefit frm solely considered priority good awareness flood risk increase yet dispute arise regarding service provision maintenance importantly increased flood risk increased runoff could lead capacity good provision exceeded leading problem distribution service reactionary pressure group formation argue current preference good reduce individual cost expense awareness discourage may problematic ensuring sustainable frm c right
133,"Sustainable Development, Climate Change Adaptation and Disaster Management",2016-01-01,"Climate change necessitates changes to the methods and procedures of disaster management. A triggering event results in disaster due to the severity of impacts and sequential, secondary consequences. These consequences result from factors such as the biophysical, social, political, economic, and structural context of the community experiencing the event. Climate change adds an additional progressive factor that increases the potential severity and frequency of triggering events and the vulnerability of communities experiencing the impact. Projecting future climate change impacts is imperfect, with a high degree of uncertainty. This uncertainty combined with the self-organizing, emergent properties that characterize urban systems, demands evaluation of the question, what qualifies as recovery? The manner in which policy is formulated must be adjusted to accommodate the dynamic contexts that may be subject to disaster triggering events. To address this need, disaster management must make adaptive capacity one of its primary goals. This is achieved through a process that combines risk assessment, comprehensive vulnerability assessment, iterative policy development and implementation, and ongoing public engagement. One of the critical aspects to long-term disaster recovery in the context of climate change is consideration of both local and regional contexts. Future adaptive capacity is closely tied with regional sustainability. This connection to sustainability is due to the fact that progressive climate change may further stress systems already being pushed by human development such as water and air pollution, habitat loss, and other degraded ecosystem services. Disaster events can result in the breaking of already stressed system connections. This confluence of events must be considered as part of disaster management. Further, ongoing monitoring of these systems and clear acknowledgement of their role in the ongoing functioning and vitality of a city is critical. Without continuous monitoring and iterative update of management procedures and local policy, communities will not be adequately prepared for an uncertain future.",305,necessitates change method procedure disaster management triggering event result disaster due severity impact sequential secondary consequence consequence factor biophysical social political economic structural context community experiencing event add additional progressive factor increase potential severity frequency triggering event vulnerability community experiencing impact projecting future impact imperfect high degree uncertainty uncertainty combined self organizing emergent property characterize urban system demand evaluation question qualifies recovery manner policy formulated must adjusted accommodate dynamic context may subject disaster triggering event address need disaster management must make adaptive capacity primary goal achieved process combine risk assessment comprehensive vulnerability assessment iterative policy development implementation ongoing critical aspect long term disaster recovery context consideration local regional context future adaptive capacity closely tied regional sustainability connection sustainability due fact progressive may stress system already pushed human development water air pollution habitat loss degraded ecosystem service disaster event breaking already stressed system connection confluence event must considered part disaster management ongoing monitoring system clear acknowledgement role ongoing functioning vitality city critical without continuous monitoring iterative update management procedure local policy community adequately prepared uncertain future
134,Earthquake risk communication as dialogue - insights from a workshop in Istanbul's urban renewal neighbourhoods,2016-01-01,"An important paradox of hazard communication is that the more effectively a potential physical threat is made public by the scientist, the more readily the scientific message becomes normalized into the daily discourses of ordinary life. As a result, a heightened risk awareness does not necessarily motivate personal or collective preparedness. If geoscientists are to help at-risk communities adopt meaningful measures to protect themselves, new strategies are needed for public communication and community engagement. This paper outlines an attempt to develop a novel approach to train geoscientists, using doctoral and post-doctoral researchers in an EU integrated training network studying tectonic processes and geohazards in Turkey. An urban field visit to seismically vulnerable neighbourhoods in Istanbul allowed the researchers to meet with local residents facing the seismic threat. Those meetings exposed the complex social, political and cultural concerns among Istanbul's at-risk urban communities. These concerns were used to provoke subsequent focus group discussions among the group of geoscientists about roles, responsibilities and methods of communicating hazard information to the public. Through the direct testimony of local residents and geoscientists, we explore the form that new strategies for public communication and community engagement might take.",193,important paradox hazard communication effectively potential physical threat made scientist readily scientific message becomes normalized daily discourse ordinary life heightened risk awareness necessarily motivate personal collective preparedness geoscientists help risk community adopt meaningful measure protect strategy needed communication community outline attempt develop novel approach train geoscientists doctoral post doctoral researcher eu integrated training network studying tectonic process geohazards turkey urban field seismically vulnerable neighbourhood istanbul allowed researcher meet local resident facing seismic threat meeting exposed complex social political cultural concern among istanbul risk urban community concern used provoke subsequent focus group discussion among group geoscientists role responsibility method communicating hazard information direct testimony local resident geoscientists explore form strategy communication community might take
135,Achievable future conditions as a framework for guiding forest conservation and management,2016-01-01,"We contend that traditional approaches to forest conservation and management will be inadequate given the predicted scale of social-economic and biophysical changes in the 21st century. New approaches, focused on anticipating and guiding ecological responses to change, are urgently needed to ensure the full value of forest ecosystem services for future generations. These approaches acknowledge that change is inevitable and sometimes irreversible, and that maintenance of ecosystem services depends in part on novel ecosystems, i.e., species combinations with no analog in the past. We propose that ecological responses be evaluated at landscape or regional scales using risk-based approaches to incorporate uncertainty into forest management efforts with subsequent goals for management based on Achievable Future Conditions (AFC). AFCs defined at a landscape or regional scale incorporate advancements in ecosystem management, including adaptive approaches, resilience, and desired future conditions into the context of the Anthropocene. Inherently forward looking, ACFs encompass mitigation and adaptation options to respond to scenarios of projected future biophysical, social-economic, and policy conditions which distribute risk and provide diversity of response to uncertainty. The engagement of science-management-public partnerships is critical to our risk-based approach for defining AFCs. Robust monitoring programs of forest management actions are also crucial to address uncertainty regarding species distributions and ecosystem processes. Development of regional indicators of response will also be essential to evaluate outcomes of management strategies. Our conceptual framework provides a starting point to move toward AFCs for forest management, illustrated with examples from fire and water management in the Southeastern United States. Our model is adaptive, incorporating evaluation and modification as new information becomes available and as social-ecological dynamics change. It expands on established principles of ecosystem management and best management practices (BMPs) and incorporates scenarios of future conditions. It also highlights the potential limits of existing institutional structures for defining AFCs and achieving them. In an uncertain future of rapid change and abrupt, unforeseen transitions, adjustments in management approaches will be necessary and some actions will fail. However, it is increasingly evident that the greatest risk is posed by continuing to implement strategies inconsistent with current understanding of our novel future. (C) 2015 Elsevier B.V. All rights reserved.",357,contend traditional approach forest conservation management inadequate given predicted scale social economic biophysical change st century approach focused anticipating guiding ecological response urgently needed ensure full value forest ecosystem service future generation approach acknowledge inevitable sometimes irreversible maintenance ecosystem service depends part novel ecosystem e specie combination analog past propose ecological response evaluated landscape regional scale risk based approach incorporate uncertainty forest management effort subsequent goal management based achievable future condition afc afcs defined landscape regional scale incorporate advancement ecosystem management including adaptive approach resilience desired future condition context anthropocene inherently forward looking acfs encompass mitigation option respond scenario projected future biophysical social economic policy condition distribute risk provide diversity response uncertainty science management partnership critical risk based approach defining afcs robust monitoring program forest management action crucial address uncertainty regarding specie distribution ecosystem process development regional indicator response essential evaluate outcome management strategy conceptual framework provides starting point move toward afcs forest management illustrated example fire water management southeastern united state model adaptive incorporating evaluation modification information becomes available social ecological dynamic expands established principle ecosystem management best management practice bmps incorporates scenario future condition highlight potential limit existing institutional structure defining afcs achieving uncertain future rapid abrupt unforeseen transition adjustment management approach necessary action fail however increasingly evident greatest risk posed continuing implement strategy inconsistent current understanding novel future c b v right
136,Outdoor Water Use as an Adaptation Problem: Insights from North American Cities,2016-01-01,"Recent efforts to influence the efficiency and timing of urban indoor water use through education, technology, conservation, reuse, economic incentives, and regulatory mechanisms have enabled many North American cities to accommodate population growth and buffer impacts of drought. It is unlikely that this approach will be equally successful into the future because the source of conservation will shift from indoor to outdoor use. Outdoor water is climate sensitive, difficult to measure, hard to predict, linked to other components of complex and dynamic urban resource systems, imbued with behavioral and cultural dimensions, and implicated in societal conflicts about climate risk, modern lifestyles, social justice, and future growth. Outdoor water conservation is not a traditional management problem focused on the water sector, assuming a stationary climate, and set aside from public debate. Instead, outdoor water is an adaptation problem, involving complex and uncertain system dynamics, the need for cross-sector coordination, strategies for dealing with climatic uncertainty, and mechanisms for engaging stakeholders with differing goals. This paper makes the case for treating outdoor water as an adaptation problem and offers a six-point strategy for how cities can better prepare their water systems for the uncertainties of climate and societal change.",197,recent effort influence efficiency timing urban indoor water use education technology conservation reuse economic incentive regulatory mechanism enabled many north american city accommodate population growth buffer impact drought unlikely approach equally successful future source conservation shift indoor outdoor use outdoor water sensitive difficult measure hard predict linked component complex dynamic urban resource system imbued behavioral cultural dimension implicated societal conflict risk modern lifestyle social justice future growth outdoor water conservation traditional management problem focused water sector assuming stationary set aside debate instead outdoor water problem involving complex uncertain system dynamic need cross sector coordination strategy dealing climatic uncertainty mechanism engaging stakeholder differing goal make treating outdoor water problem offer six point strategy city better prepare water system uncertainty societal
