,title,date,abstract,word_count,abstract_clean
192,"Moving beyond the metaphor, reaching beyond the rhetoric: Social work education in a changing environment",2017-01-01,"This article explores Australian social work's engagement with environmental concerns through a review of scholarly literature and professional documentation, and suggests the professional imagination and espoused professional identity of social work practice as expressed in Australian social work education share significant common ground with the concerns of sustainability education. This raises the question of why it is that social work has yet to infuse, embed, or otherwise engage with the adoption of the principles of education for sustainability. The review found that social work has developed some momentum in negotiating challenges emerging as a consequence of climate change and other forms of complexity, but remains educationally challenged by the imperatives that follow commitment to sustainability in practice. To move beyond the metaphorical sense in which social work has previously used the term 'environment' requires re-framing of social work education's purview, and rethinking of the approaches used to incorporate sustainability concerns into professional practice qualifications. Principles of inquiry based learning and sustainability education are suggested, as the next step towards integrating and embedding the concerns of the future with revised social work praxis. (C) 2017 Elsevier Ltd. All rights reserved.",189,explores australian social work environmental concern review scholarly literature professional documentation suggests professional imagination espoused professional identity social work practice expressed australian social work education share significant common ground concern sustainability education raise question social work yet infuse embed otherwise engage adoption principle education sustainability review found social work developed momentum negotiating challenge emerging consequence form complexity remains educationally challenged imperative follow commitment sustainability practice move beyond metaphorical sense social work used term environment requires framing social work education purview rethinking approach used incorporate sustainability concern professional practice qualification principle inquiry based learning sustainability education suggested next step towards integrating embedding concern future revised social work praxis c right
193,Enacting collective support for the European integration: Participation in pro-integration action and preference for specific transnational acculturation strategies,2018-01-01,"We propose that collective support for European integration is mani-fested in 2 distinct forms: first, as engagement in socio-political action by citizens who seek to change their nation and its status in Europe. Second, it is manifested as a transnational acculturation process that impacts on both nations and their citizens. These processes potentially engage social identities at 3 levels: national, European and as supporters of the European integration. Here, we examine these different levels of identification as part of a model predicting collective support for the European integration. To capture the dimension of transnationality, we collected data from 2 Romanian samples, 1 of participants living in their country of origin (N=203), and 1 of participants living as migrants outside Romania (N=196). We found that identification as a pro-integration supporter flows from European and Romanian national identifications and is an excellent predictor of collective support for European integration in both its forms. We conclude by discussing how our findings can be applied to the design of intervention strategies and policies to promote support for the European Union and the integration process in the current socio-political climate (where the unity and the very existence of European Union are under threat).",198,propose collective support european integration mani fested distinct form first socio political action citizen seek nation status europe second manifested transnational acculturation process impact nation citizen process potentially engage social identity level national european supporter european integration examine different level identification part model predicting collective support european integration capture dimension transnationality collected data romanian sample participant living country origin n participant living migrant outside romania n found identification pro integration supporter flow european romanian national identification excellent predictor collective support european integration form conclude discussing finding applied design intervention strategy policy promote support european union integration process current socio political unity existence european union threat
194,"'We cannot be at the forefront, changing society': exploring how Swedish property developers respond to climate change in urban planning",2018-01-01,"It is increasingly expected that private actors play the role as entrepreneurs and frontrunners in implementing climate measures, whereas empirical studies of the position, role and engagement of private actors are scarce. Situated in the context of urban planning, a critical arena for triggering climate transitions, the aim of this paper is to explore how Swedish property developers respond to climate change. Qualitative analyses of corporate policy documents and semi-structured interviews with property developers reveal a vast divergence between the written policies, where leadership ambitions are high, and how the practice of property development is discussed in interviews. In the latter, there is little evidence of property developers pursuing a forward-looking or cutting-edge climate change agenda. Instead, they are critical of increased public regulation for climate-oriented measures. Explanations both confirm previous studies, highlighting lack of perceived customer demand, uncertainty of financial returns and limited innovations, and add new elements of place-dependency suggesting that innovative and front-runner practices can only be realized in the larger urban areas. Municipalities seeking to improve their climate-oriented profile in urban planning by involving private property developers need to develop strategies to maneuver the variance in responses to increase the effectiveness of implementation.",197,increasingly expected private actor play role entrepreneur frontrunners implementing measure whereas empirical study position role private actor scarce situated context urban planning critical arena triggering transition aim explore swedish property developer respond qualitative analysis corporate policy document semi structured interview property developer reveal vast divergence written policy leadership ambition high practice property development discussed interview latter little evidence property developer pursuing forward looking cutting edge agenda instead critical increased regulation oriented measure explanation confirm previous study highlighting lack perceived customer demand uncertainty financial return innovation add element place dependency suggesting innovative front runner practice realized larger urban area municipality seeking improve oriented profile urban planning involving private property developer need develop strategy maneuver variance response increase effectiveness implementation
195,Climate change and national security: an agenda for geography,2018-01-01,"On 4 December 2017 the Australian Foreign Affairs, Defence and Trade References Committee is due to report on its inquiry into the implications of climate change for Australia's national security. Public submissions to the inquiry closed on 4 August 2017 and, at the time of writing, some 59 submissions had been made by researchers, public-interest organisations and members of the public, including a number of geographers. A topic of profound significance, climate change and national security warrants deep and sustained public engagement such as that offered by the Senate Inquiry submission process. In this Thinking Space essay, I urge geographers, working in Australia and internationally, to make ongoing contributions to such engagements. The emerging debate about climate change and national security will likely amplify following the release of the Committee's report. Geographic data and analysis pertaining to various aspects of climate change and security are needed in order to shape policy directions and support evidence-based policy making. My contention here is that contributions ought to extend not just from those working at the coalface of climate change risk, for example in political geography, but from all quarters of the discipline.",190,december australian foreign affair defence trade reference committee due report inquiry implication australia national security submission inquiry closed august time writing submission made researcher interest organisation member including number geographer topic profound significance national security warrant deep sustained offered senate inquiry submission process thinking space essay urge geographer working australia internationally make ongoing contribution engagement emerging debate national security likely amplify following release committee report geographic data analysis pertaining various aspect security needed order shape policy direction support evidence based policy making contention contribution ought extend working coalface risk example political geography quarter discipline
196,Climate change adaptation policies and plans: A survey in 11 South East European countries,2018-01-01,"Building a climate-ready adaptation society is an urgent question that cannot be postponed. Along the path towards an increase in climate resilience, a stimulating role is played by EU projects as well as by international climate networks such as the Covenant of Mayors Initiative on Climate Change Adaptation (Mayors Adapt), launched in 2014, and the new Covenant of Mayors for Climate and Energy which ""pledge to reduce CO2 emissions by at least 40% by 2030 and to adopt an integrated approach to tackling mitigation and adaptation to climate change"". These initiatives stimulate engagement and networking among cities and raise public awareness encouraging policy makers to take action to adapt to climate change. Adaptation operates at different spatial and societal scales. Accordingly, the development of climate change adaptation strategies requires a holistic and multi-perspective approach with scale-specific studies. This paper provides an overview of adaptation initiatives undertaken in",147,building ready society urgent question cannot postponed along path towards increase resilience stimulating role played eu project well international network covenant mayor initiative mayor adapt launched covenant mayor energy pledge reduce co emission least adopt integrated approach tackling mitigation initiative stimulate networking among city raise awareness encouraging policy maker take action adapt operates different spatial societal scale accordingly development strategy requires holistic multi perspective approach scale specific study provides overview initiative undertaken
197,Localizing Climate Change: Nordic Homeowners' Interpretations of Visual Representations for Climate Adaptation,2018-01-01,"In recent years, effort has been put into developing various forms of climate visualization to create opportunities for people to explore and learn about local climate change risks and adaptation options. However, how target audiences make sense of such climate visualization has rarely been studied from a communication perspective. This paper analyses how Nordic homeowners made sense of a specific climate visualization tool, the VisAdapt tool. Involving 35 homeowners from three cities in 15 group test sessions, this study analyses the interpretive strategies participants applied to make sense of and assess the relevance of the visualized data. The study demonstrates that participants employed a set of interpretive strategies relating to personal experience and well-known places to make sense of the information presented, and that critical negotiation of content played an important role in how participants interpreted the content.",138,recent year effort put developing various form visualization create opportunity people explore learn local risk option however target audience make sense visualization rarely studied communication perspective analysis nordic homeowner made sense specific visualization tool visadapt tool involving homeowner three city group test session analysis interpretive strategy participant applied make sense ass relevance visualized data demonstrates participant employed set interpretive strategy relating personal experience well known place make sense information presented critical negotiation content played important role participant interpreted content
198,Beliefs and values explain international differences in perception of solar radiation management: insights from a cross-country survey,2017-01-01,"Solar radiation management (SRM) aims to counteract the negative consequences of global warming and is considered for deployment in the event that mitigation and adaptation efforts appear insufficient. However, because the potential ecological and political side effects of SRM are not well understood, and because SRM will cross national boundaries, an international research perspective on the general public's perception of this technology is required. We conducted an online survey on the general public's perception and acceptance of SRM in Canada, China, Germany, Switzerland, the UK, and the USA. Our findings confirmed the need for an international perspective, as we found several cross-country differences. Chinese respondents, for example, indicated greater acceptance for SRM than their North American and European counterparts. Moreover, results of regression analyses on acceptance of SRM by country revealed that lower acceptability ratings for SRM in Canada and Europe were mostly related to stronger beliefs that SRM tampers with nature. Chinese respondents, by contrast, were more accepting of SRM when they held stronger beliefs that it may reduce the motivation to adopt burdensome climate change mitigation efforts. Although our research-and previous studies-suggest that opposition to SRM remains, dismissing the technology entirely on these grounds and without conducting a careful, cross-national, and transdisciplinary decision-support process to set up an international policy regime seems premature as people from countries that are less prepared to mitigate and adapt to climate change seem to be more supportive of SRM.",237,solar radiation management srm aim counteract negative consequence global warming considered deployment event mitigation effort appear insufficient however potential ecological political side effect srm well understood srm cross national boundary international research perspective general perception technology required conducted online survey general perception acceptance srm canada china germany switzerland uk usa finding confirmed need international perspective found several cross country difference chinese respondent example indicated greater acceptance srm north american european counterpart moreover result regression analysis acceptance srm country revealed lower acceptability rating srm canada europe mostly related stronger belief srm tamper nature chinese respondent contrast accepting srm held stronger belief may reduce motivation adopt burdensome mitigation effort although research previous study suggest opposition srm remains dismissing technology entirely ground without conducting careful cross national transdisciplinary decision support process set international policy regime seems premature people country le prepared mitigate adapt seem supportive srm
199,Contribuciones de la Psicologa al abordaje de la dimensin humana del cambio climtico en Chile (Primera parte),2017-01-01,"Multiple studies show that the integration of social and psychological factors in the design, implementation and evaluation of mitigation and adaptation strategies is paramount to address the complexities of climate change. Such factors influence both the perception of the problem and the responses to it in every social system. Considering a multi-level approach encompassing institutional, communitarian and personal dimensions, the inclusion of these psychological aspects can help to increase the importance of climate change in society, favor a deeper community engagement, improving public policies, and strengthen individual, social and institutional resilience. Although Chile is one of the most vulnerable countries in the world regarding climate change impacts, presenting seven out of nine vulnerability criteria, the study of the social and psychological dimensions of climate change in our country is limited and its importance for policy-making generally unknown. In such a context we organized a literature review aimed at exploring how Psychology can contribute to address the human dimensions of climate change in Chile considering a wide range of topics. To do this a reasonable high number of specialized databases and scientific journals were used. As a result of this work we expect to encourage scholars from diverse disciplines, not only psychologist, to dig deeper on these issues in the Chile an and Latin American context to fill this gap in the knowledge. The literature review showed that most research has been conducted in developed countries such as United States, Australia, and United Kingdom. This is expected considering the high levels of political polarization about climate change in those countries, either regarding the causes of the problem, the actions needed to address it, or even if it is happening or not. Contrariwise, we only found a reduced number of articles addressing specifically the psychological aspects of climate change in both Latin America and Chile. Interestingly, mainly scholars from other disciplines generally related to environmental management, planning, Sociology and other social sciences, rather than psychologists, have conducted those studies in the region, most of them focused on issues such as social vulnerability, inequalities, poverty alleviation, political participation and agriculture in rural and indigenous communities in the context of droughts or water management related issues. Results of this review are presented in two parts covering five main topics reflecting the most relevant issues identified in the interaction between psychological factors and climate change in the literature. Part one presents a short introduction on climate change impacts in Chile and the high level of vulnerability of our country given by geographic, environmental and social factors. Then we explain the link between Psychology and environmental problems in general, describing the main issues covered by two specialized sub disciplines called Environmental Psychology and Conservation Psychology. After that we present four sections summarizing the main findings of the literature review. These include the complexities of climate change communication; beliefs, values, attitudes and behaviors; psychological drivers and barriers for climate change action; and the emergent study of the impacts of climate change and mental health. This sets the basis for a framework to organize and encourage research in this area and to integrate this knowledge in policy-making in the Chilean context. Overall, this review suggests that psychology's contributions to address climate change challenges will improve our understanding of the complex relationship between people and nature in general and society and climate change in particular. However, to have a significant impact in policy-making, psychological studies need to be part of wider multidisciplinary teams and work at multiple levels, specially close to communities and public institutions avoiding an excessive experimentalism and academicism preventing isolation from society.",596,multiple study integration social psychological factor design implementation evaluation mitigation strategy paramount address complexity factor influence perception problem response every social system considering multi level approach encompassing institutional communitarian personal dimension inclusion psychological aspect help increase importance society favor deeper community improving policy strengthen individual social institutional resilience although chile vulnerable country world regarding impact presenting seven nine vulnerability criterion social psychological dimension country importance policy making generally unknown context organized literature review aimed exploring psychology contribute address human dimension chile considering wide range topic reasonable high number specialized database scientific journal used work expect encourage scholar diverse discipline psychologist dig deeper issue chile latin american context fill gap knowledge literature review showed research conducted developed country united state australia united kingdom expected considering high level political polarization country either regarding cause problem action needed address even happening contrariwise found reduced number article addressing specifically psychological aspect latin america chile interestingly mainly scholar discipline generally related environmental management planning sociology social science rather psychologist conducted study region focused issue social vulnerability inequality poverty alleviation political participation agriculture rural indigenous community context drought water management related issue result review presented part covering five main topic reflecting relevant issue identified interaction psychological factor literature part present short introduction impact chile high level vulnerability country given geographic environmental social factor explain link psychology environmental problem general describing main issue covered specialized sub discipline called environmental psychology conservation psychology present four section summarizing main finding literature review include complexity communication belief value attitude behavior psychological driver barrier action emergent impact mental health set basis framework organize encourage research area integrate knowledge policy making chilean context overall review suggests psychology contribution address challenge improve understanding complex relationship people nature general society particular however significant impact policy making psychological study need part wider multidisciplinary team work multiple level specially close community institution avoiding excessive experimentalism academicism preventing isolation society
200,Narrating climate futures: shared socioeconomic pathways and literary fiction,2017-01-01,"In parallel with five new scientific scenarios of alternative societal developments (shared socioeconomic pathways, SSPs), a wide range of literary representations of a future world in which climate change comes to matter have emerged in the last decade. Both kinds of narrative are important forms of ""world-making."" This article initiates a conversation between science and literature through situating, relating, and comparing contemporary climate change fiction to the five SSPs. A parallel reading of the SSPs and the novels provides the means to make links between larger societal trends and personal accounts of climate change. The article shows how literary fiction creates engagement with climate change through particular accounts of agency and focalized perspectives in a different way than how the factors important to challenges of mitigation and adaptation are narrated in the SSPs. Through identification with the protagonists in literary fiction, climate futures become close and personal rather than distant and abstract.",152,parallel five scientific scenario alternative societal development shared socioeconomic pathway ssps wide range literary representation future world come matter emerged last decade kind narrative important form world making initiate conversation science literature situating relating comparing contemporary fiction five ssps parallel reading ssps novel provides mean make link larger societal trend personal account show literary fiction creates particular account agency focalized perspective different way factor important challenge mitigation narrated ssps identification protagonist literary fiction future become close personal rather distant abstract
